[
  {
    "id": 1,
    "name": "Centro de Salud San Anselmo",
    "type": "Community",
    "city": "Madrid",
    "province": "Madrid",
    "address": "Paseo de las Acacias, 120",
    "postal_code": "28013",
    "phone": "+34 910 685 072",
    "beds": 132,
    "founded": 1969
  },
  {
    "id": 2,
    "name": "Hospital General de Vitoria-Gasteiz",
    "type": "General",
    "city": "Vitoria-Gasteiz",
    "province": "Álava",
    "address": "Ronda de Santa María, 49, 3º D",
    "postal_code": "01032",
    "phone": "+34 945 861 793",
    "beds": 405,
    "founded": 2005
  },
  {
    "id": 3,
    "name": "Hospital General de A Coruña",
    "type": "General",
    "city": "A Coruña",
    "province": "A Coruña",
    "address": "Calle Real, 140, 6º Dcha.",
    "postal_code": "15032",
    "phone": "+34 981 332 934",
    "beds": 249,
    "founded": 1908
  },
  {
    "id": 4,
    "name": "Hospital San Teodoro",
    "type": "General",
    "city": "Bilbao",
    "province": "Bizkaia",
    "address": "Calle de la Fuente, 12",
    "postal_code": "48062",
    "phone": "+34 944 029 105",
    "beds": 326,
    "founded": 1997
  },
  {
    "id": 5,
    "name": "Hospital Universitario Nuestra Señora del Alba",
    "type": "Teaching",
    "city": "Madrid",
    "province": "Madrid",
    "address": "Calle del Duero, 157",
    "postal_code": "28035",
    "phone": "+34 911 064 293",
    "beds": 793,
    "founded": 1915
  },
  {
    "id": 6,
    "name": "Instituto San Fulgencio",
    "type": "Specialist",
    "city": "Barcelona",
    "province": "Barcelona",
    "address": "Avenida de la Libertad, 131, 4º B",
    "postal_code": "08038",
    "phone": "+34 932 049 533",
    "beds": 222,
    "founded": 1931
  },
  {
    "id": 7,
    "name": "Instituto Santa Perpetua",
    "type": "Specialist",
    "city": "Málaga",
    "province": "Málaga",
    "address": "Avenida de Federico García Lorca, 158",
    "postal_code": "29011",
    "phone": "+34 952 397 734",
    "beds": 153,
    "founded": 1909
  },
  {
    "id": 8,
    "name": "Hospital Clínico San Adriano",
    "type": "Teaching",
    "city": "L'Hospitalet de Llobregat",
    "province": "Barcelona",
    "address": "Plaza del Carmen, 163, 5º B",
    "postal_code": "08038",
    "phone": "+34 934 259 414",
    "beds": 756,
    "founded": 1933
  },
  {
    "id": 9,
    "name": "Centro de Salud Virgen del Espino",
    "type": "Community",
    "city": "Oviedo",
    "province": "Asturias",
    "address": "Calle Alcalá, 145, 9º D",
    "postal_code": "33050",
    "phone": "+34 985 501 739",
    "beds": 126,
    "founded": 1927
  },
  {
    "id": 10,
    "name": "Hospital Clínico Santa Inés",
    "type": "Teaching",
    "city": "Madrid",
    "province": "Madrid",
    "address": "Avenida Serrano, 78",
    "postal_code": "28059",
    "phone": "+34 912 634 557",
    "beds": 645,
    "founded": 1897
  },
  {
    "id": 11,
    "name": "Hospital Infantil San Baudilio",
    "type": "Children's",
    "city": "Oviedo",
    "province": "Asturias",
    "address": "Calle de Blas de Otero, 33, 3º Izq.",
    "postal_code": "33029",
    "phone": "+34 985 553 642",
    "beds": 207,
    "founded": 1991
  },
  {
    "id": 12,
    "name": "Hospital Universitario Nuestra Señora del Robledo",
    "type": "Teaching",
    "city": "Sevilla",
    "province": "Sevilla",
    "address": "Avenida de Andalucía, 95",
    "postal_code": "41024",
    "phone": "+34 954 969 354",
    "beds": 788,
    "founded": 1937
  },
  {
    "id": 13,
    "name": "Hospital Universitario San Hilario",
    "type": "Teaching",
    "city": "Sevilla",
    "province": "Sevilla",
    "address": "Calle de San José, 161, 4º A",
    "postal_code": "41064",
    "phone": "+34 954 333 906",
    "beds": 822,
    "founded": 1981
  },
  {
    "id": 14,
    "name": "Hospital Infantil Santa Genoveva",
    "type": "Children's",
    "city": "Zaragoza",
    "province": "Zaragoza",
    "address": "Calle Mayor, 28",
    "postal_code": "50019",
    "phone": "+34 976 885 456",
    "beds": 197,
    "founded": 1961
  },
  {
    "id": 15,
    "name": "Hospital San Cosme",
    "type": "General",
    "city": "Barcelona",
    "province": "Barcelona",
    "address": "Calle Goya, 104",
    "postal_code": "08037",
    "phone": "+34 935 447 314",
    "beds": 494,
    "founded": 1892
  },
  {
    "id": 16,
    "name": "Hospital Virgen de la Alameda",
    "type": "General",
    "city": "Barcelona",
    "province": "Barcelona",
    "address": "Carrer de San Juan, 99",
    "postal_code": "08023",
    "phone": "+34 937 712 434",
    "beds": 339,
    "founded": 2005
  },
  {
    "id": 17,
    "name": "Hospital Clínico San Emeterio",
    "type": "Teaching",
    "city": "Madrid",
    "province": "Madrid",
    "address": "Calle de Federico García Lorca, 74",
    "postal_code": "28036",
    "phone": "+34 912 715 414",
    "beds": 782,
    "founded": 1933
  },
  {
    "id": 18,
    "name": "Hospital Clínico Santa Rosalía",
    "type": "Teaching",
    "city": "Alicante",
    "province": "Alicante",
    "address": "Plaza de la Iglesia, 20, 9º C",
    "postal_code": "03074",
    "phone": "+34 965 540 210",
    "beds": 596,
    "founded": 1977
  },
  {
    "id": 19,
    "name": "Hospital General de Zaragoza",
    "type": "General",
    "city": "Zaragoza",
    "province": "Zaragoza",
    "address": "Calle de las Acacias, 4",
    "postal_code": "50035",
    "phone": "+34 976 073 651",
    "beds": 335,
    "founded": 1966
  },
  {
    "id": 20,
    "name": "Clínica Virgen del Mirador",
    "type": "Specialist",
    "city": "Cartagena",
    "province": "Murcia",
    "address": "Plaza del Guadalquivir, 42, 6º C",
    "postal_code": "30064",
    "phone": "+34 968 895 212",
    "beds": 219,
    "founded": 1972
  },
  {
    "id": 21,
    "name": "Hospital General de Almería",
    "type": "General",
    "city": "Almería",
    "province": "Almería",
    "address": "Calle de la Paz, 137",
    "postal_code": "04056",
    "phone": "+34 950 598 274",
    "beds": 155,
    "founded": 2008
  },
  {
    "id": 22,
    "name": "Hospital Santa Eulalia",
    "type": "General",
    "city": "Alicante",
    "province": "Alicante",
    "address": "Calle de Aragón, 1, 8º A",
    "postal_code": "03021",
    "phone": "+34 965 206 359",
    "beds": 427,
    "founded": 1985
  },
  {
    "id": 23,
    "name": "Hospital Universitario San Bruno",
    "type": "Teaching",
    "city": "Madrid",
    "province": "Madrid",
    "address": "Calle de la Libertad, 128, 8º A",
    "postal_code": "28011",
    "phone": "+34 918 586 595",
    "beds": 587,
    "founded": 1935
  },
  {
    "id": 24,
    "name": "Hospital Virgen de la Peña",
    "type": "General",
    "city": "Alcorcón",
    "province": "Madrid",
    "address": "Calle Alcalá, 143",
    "postal_code": "28070",
    "phone": "+34 913 320 388",
    "beds": 406,
    "founded": 1916
  },
  {
    "id": 25,
    "name": "Centro de Salud Santa Columba",
    "type": "Community",
    "city": "Cáceres",
    "province": "Cáceres",
    "address": "Calle del Ebro, 180",
    "postal_code": "10055",
    "phone": "+34 927 040 531",
    "beds": 61,
    "founded": 1911
  }
]
